scene_id,working_scene_title,location,time_period,dramatic_function,evidence_ids,adaptation_decision_ids,status
SC-064,The Future Spoken Around Her,Madhavi household in Puhar,Act I opening,"Introduce Manimekalai listening while older generations discuss lineage livelihood safety and her future before she asserts a choice","EV-0147;EV-0150;EV-0158","AD-0064;AD-0072;AD-0077",concept
SC-065,The Practised Body Refuses,Puhar flower route and crystal pavilion,Act I,"Reveal artistic-household bodily training while converting balance rhythm and spatial awareness into self-protection rather than performance for the gaze","EV-0149;EV-0150;EV-0161","AD-0061;AD-0062;AD-0078",concept
SC-066,Alone Where the City Cannot See,Manipallavam shore,Act II threshold,"Let divine removal produce fear disorientation bodily testing and incomplete recognition before sacred knowledge arrives","EV-0151;EV-0159","AD-0036;AD-0073;AD-0074;AD-0075",concept
SC-067,The Weight of an Inexhaustible Vessel,Gomukhi pond and first carrying route,Act II,"Make acceptance of Amudhasurabhi a physical and moral burden rather than a triumphant acquisition","EV-0050;EV-0152;EV-0159","AD-0022;AD-0072;AD-0075;AD-0079",concept
SC-068,Compassion Learns Logistics,Ulaga Aravi feeding space,Act II,"Show Manimekalai learning that care requires other workers recipient knowledge water access order and recovery from mistakes","EV-0054;EV-0067;EV-0153","AD-0023;AD-0024;AD-0073;AD-0079",concept
SC-069,After the Prince Falls,Death site and immediate aftermath,Act II midpoint,"Force Manimekalai to hold grief fear mistaken recognition and responsibility without accepting the claim that refusal caused the prince's death","EV-0155;EV-0146","AD-0058;AD-0062;AD-0073;AD-0076",concept
SC-070,Fear Inside the Queen's House,Palace confinement and confrontation,Act II,"Preserve bodily fear and survival during coercion while building the moral precision needed to address Rajamadevi without revenge or submission","EV-0156;EV-0159;EV-0162","AD-0026;AD-0069;AD-0070;AD-0073",concept
SC-071,Questions in Another Voice,Vanji teaching quarters,Act III,"Use the sage form to expose gendered intellectual access while making Manimekalai test claims rather than repeat revelation","EV-0154;EV-0157;EV-0160","AD-0019;AD-0068;AD-0074;AD-0077",concept
SC-072,Stillness That Remains in the World,Kanchi quiet enclosure and living city,Ending,"Complete the arc with alert disciplined practice that retains memory compassion and relation to ongoing suffering rather than freezing her into a perfected icon","EV-0153;EV-0157;EV-0162","AD-0016;AD-0072;AD-0073;AD-0080",concept
