scene_id,working_scene_title,location,time_period,dramatic_function,evidence_ids,adaptation_decision_ids,status
SC-105,The Empty Festival Seat,Chitrapathi household,Preshow/Act I,"Establish Chitrapathi as guardian of public reputation when Madhavi and Manimekalai reject festival expectations","EV-0227;EV-0228","AD-0118;AD-0119",concept
SC-106,The House That Taught Survival,Artistic household,Act I,"Reveal the labour training and knowledge behind the performing lineage rather than only its public glamour","EV-0229;EV-0241","AD-0119",concept
SC-107,A Crown as Protection,Udayakumaran's court,Act II-A,"Show Chitrapathi persuading the prince through survival logic while preserving his agency","EV-0230;EV-0231","AD-0120",concept
SC-108,The Price of Fame,Chitrapathi and Madhavi's house,Act II-A,"Stage the generational argument between security through desire and autonomy through refusal","EV-0234;EV-0240","AD-0122",concept
SC-109,Before the Queen,Queen's palace,Act II-C,"Show Chitrapathi seeking Manimekalai's release and confronting consequences","EV-0232;EV-0239","AD-0121",concept
SC-110,The Elder Who Changes the Question,Later household reflection,Ending,"Allow recognition that Manimekalai's freedom is another form of survival rather than simple rejection of the old world","EV-0242","AD-0122",concept
