scene_id,working_scene_title,location,time_period,dramatic_function,evidence_ids,adaptation_decision_ids,status
SC-001,Dawn at the Kaveri mouth,Puhar river-sea harbour,Festival day 1,"Establish maritime city, labour and civic scale","EV-0005;EV-0007;EV-0008;EV-0010;EV-0027;EV-0033","AD-0003;AD-0005;AD-0006;AD-0009",concept
SC-002,The proclamation drum,Puhar civic route,Festival day 1,"Announce festival and its promise of order and abundance","EV-0001;EV-0002;EV-0003;EV-0004;EV-0025;EV-0033","AD-0001;AD-0002;AD-0008;AD-0009",concept
SC-003,Madhavi's silent house,Puhar performance quarter,Festival day 1,"Contrast public celebration with private renunciation and inherited grief","EV-0021;EV-0022;EV-0025;EV-0034","AD-0008;AD-0009;AD-0010;AD-0012",concept
SC-004,The city of abundance,Puhar multiple districts,Festival day 1,"Reveal wealth, religious plurality and those excluded from prosperity","EV-0003;EV-0004;EV-0005;EV-0028;EV-0029;EV-0030;EV-0031;EV-0033","AD-0001;AD-0009;AD-0012",concept
SC-005,Flowers under the public gaze,Puhar flower garden,Act I,"Reveal Manimekalai's beauty, social visibility and vulnerability to pursuit","EV-0021;EV-0022;EV-0024;EV-0025","AD-0008;AD-0010;AD-0012",concept
SC-006,The vessel that serves,Puhar feeding place,Act II,"Show Manimekalai's transformation through practical service and the prince's inability to accept it","EV-0022;EV-0023;EV-0032;EV-0033","AD-0009;AD-0010;AD-0011;AD-0013",concept
SC-007,The form of Kayasandihai,Sambapathi temple,Act II,"Make Manimekalai's disguise legible to the audience and credible to both Udayakumaran and Kanchanan","EV-0026;EV-0033","AD-0009;AD-0010",concept
SC-008,Cloth after scarcity,Kanchi,Act III,"Make famine visible through repair, sale, reuse and unequal preservation of clothing and ornament","EV-0028;EV-0029;EV-0031;EV-0032;EV-0033","AD-0009;AD-0012;AD-0013",concept
