scene_id,working_scene_title,location,time_period,dramatic_function,evidence_ids,adaptation_decision_ids,status
SC-048,The Sceptre and the Rain,Puhar royal space,Festival period,"Establish ruler duty and connection between justice and welfare","EV-0122","AD-0056",concept
SC-049,The Prince Who Would Not Listen,Udayakumaran spaces,Act I-II,"Show royal desire conflicting with personal freedom","EV-0122","AD-0057",concept
SC-050,The Court Hears the Death,Royal court,Act II,"Separate grief from investigation and responsibility","EV-0124;EV-0125","AD-0058;AD-0060",concept
SC-051,A Prison Opens,Prison institution,Act II,"Show punishment becoming care","EV-0123","AD-0059",concept
SC-052,The Queen's Grief,Palace chamber,Act II,"Show grief becoming abuse and later recognition","EV-0124;EV-0125","AD-0060",concept
SC-053,Justice Without Revenge,Throne hall,Act III,"Resolve through compassion rather than revenge","EV-0122;EV-0123","AD-0056;AD-0059",concept
