decision_id,title,status,source_observation,risk,decision,rationale,evidence_ids,required_review
AD-0047,Economy is shown through labour chains,binding,"The epic names specialised occupations while archaeology preserves production and exchange evidence","Markets could become decorative displays of finished luxury goods","Show extraction making transport valuation sale repair and waste for every major commodity","Makes wealth materially and socially legible","EV-0103;EV-0109;EV-0112;EV-0119","Economic history; craft archaeology; production design; screenplay"
AD-0048,Performers are skilled workers,binding,"Chapter 2 presents a broad disciplined curriculum for performing women","Madhavi's world could be reduced to beauty and erotic spectacle","Show training rehearsal musicians maintenance patron negotiation and household economics alongside artistic authority","Preserves skill and social constraint","EV-0104","Classical Tamil; performance history; gender history; choreography"
AD-0049,No Roman colonial port framing,binding,"Imported ceramics and coins occur at Tamil coastal and inland sites","Familiar visual shorthand may turn Puhar into a Roman settlement or make foreigners the source of local prosperity","Represent imported objects within Tamil-led multi-stage exchange and use foreign residents only where evidence supports them","Avoids colonial and archaeological overstatement","EV-0110;EV-0111;EV-0117","Indian Ocean archaeology; classical studies; casting; publicity"
AD-0050,No medieval guild institutions in early Puhar,binding,"Early corporate references are limited while richly documented guild systems belong mainly to later centuries","Guild banners armies titles and charters could be imported from medieval inscriptions","Show collective merchant practice through reputation witnesses storage and coordinated travel without later institutional forms","Allows organisation without chronological collapse","EV-0115;EV-0116","Epigraphy; economic history; screenplay; production design"
AD-0051,Mixed forms of exchange,binding_provisional,"Coins weights grain gifts services alms and valuable objects coexist in the evidence","A coin-only marketplace would impose a modern monetised economy","Use multiple forms of value transfer and approve no exact conversion rate or universal denomination before review","Creates plausible exchange while retaining uncertainty","EV-0107;EV-0114;EV-0118","Numismatics; metrology; economic history; props"
AD-0052,Writing on objects requires epigraphic control,binding,"Tamil-Brahmi occurs on portable objects but its function varies","Decorative pseudo-script or convenient ownership labels would manufacture evidence","Every inscription prop must use reviewed text purpose placement and palaeography","Protects textual integrity and public trust","EV-0114","Tamil-Brahmi epigraphy; prop design; art department"
AD-0053,Craft technique does not code ethnicity,binding,"Connected craft communities used varied techniques across multiple sites","Costume and casting could turn one technology into an ethnic stereotype","Differentiate workers through documented practice and biography rather than assigning ethnicity from product style","Avoids material-culture essentialism","EV-0112;EV-0113;EV-0120","Craft archaeology; anthropology; casting; sensitivity review"
AD-0054,Merchant wealth includes distributed risk,binding,"Voyages depend on crews labour suppliers and families while wrecks distribute loss unevenly","Merchants could appear as isolated heroic wealth creators","Show pilots loaders packers repairers dependants and competing claims around every major voyage or cargo loss","Connects maritime spectacle to labour and vulnerability","EV-0105;EV-0106;EV-0119","Maritime history; labour history; screenplay"
AD-0055,Poverty is connected to disrupted livelihood,binding,"The epic links hunger with injury begging famine and failed access","Poor characters could appear as a timeless anonymous class","Use recurring households and visible loss of work tools mobility and market access before relief scenes","Preserves causation and recipient dignity","EV-0108;EV-0121","Social history; disability review; famine studies; screenplay"
