decision_id,decision_type,decision,reason,status
AD-0153,IDENTITY,Do not portray Punniyarajan as merely Aputhiran returned,Present identity and prior-life continuity must coexist,approved
AD-0154,REBIRTH,Show memory as ethical revelation rather than replacement personality,Prevents flattening character into previous life,approved
AD-0155,KINGSHIP,Make governance a moral responsibility equal to personal liberation,Supported by Janamithran's warning,approved
AD-0156,PROSPERITY,Do not depict prosperity as automatic proof of personal holiness,Separates symbolism from institutions,approved
AD-0157,MINISTER,Give Janamithran serious ethical authority rather than comic opposition,His counsel protects subjects,approved
AD-0158,MANIPALLAVAM,Portray journey as pilgrimage and self-knowledge not escape tourism,Preserves dramatic purpose,approved
AD-0159,AMUDHASURABHI,Connect Punniyarajan's memory to service rather than ownership of vessel,Continuity with Aputhiran,approved
AD-0160,RENUNCIATION,Do not reward abandonment of duties as automatically superior,Living people remain moral subjects,approved
AD-0161,RULE,Future screenplay should explore compassionate kingship informed by Aputhiran's begging life,Completes character transformation,approved
AD-0162,CASTING,Same actor as Aputhiran remains unresolved,Could clarify or falsely simplify rebirth,open
